{
  "alternatives": [
    "alt-omfv-concept",
    "alt-m2a4-bradley"
  ],
  "asOf": "2021-09-30",
  "assumptions": [
    "as-poland-bridges",
    "as-manning-dec"
  ],
  "biasChecks": [],
  "charter": "ch-omfv",
  "claims": [],
  "constraints": [
    "con-30-dismounts",
    "con-two-crew",
    "con-crew-in-hull"
  ],
  "createdAt": "2021-09-30T00:00:00Z",
  "createdBy": {
    "actorId": "shreyash",
    "actorType": "human"
  },
  "evidenceRegister": [
    "ev-con-2020-02",
    "ev-industry-day-narrative-2020-04",
    "ev-breaking-defense",
    "ev-con-2020-12",
    "ev-threat-analysis",
    "ev-market-research-2020",
    "ev-abct-opconcept",
    "ev-aries-1",
    "ev-aries-2",
    "ev-trac-aoa",
    "ev-trac-oe",
    "ev-mbl-1",
    "ev-hsi-1",
    "ev-hsi-2",
    "ev-vendor-feedback-1",
    "ev-vendor-feedback-2",
    "ev-vendor-feedback-3",
    "ev-vendor-feedback-4",
    "ev-bradley-swapc-2018",
    "ev-market-research-study-2020",
    "ev-concept-design-2021"
  ],
  "flipAnalyses": [],
  "groundRules": [],
  "id": "ep-omfv-2020-02-r3",
  "lifecycleState": "PLAN_APPROVED",
  "mandateElements": [],
  "models": [
    "mdl-aries",
    "mdl-trac"
  ],
  "narratives": [],
  "objectives": [
    "obj-survivability-dec",
    "obj-mobility",
    "obj-growth",
    "obj-lethality",
    "obj-weight",
    "obj-logistics",
    "obj-transportability",
    "obj-manning-dec",
    "obj-training"
  ],
  "observations": [],
  "plan": "pl-omfv-r3",
  "program": "prg-omfv",
  "refreshedBecause": "rt-phase2-efforts",
  "replacements": {},
  "rev": 4,
  "risks": [],
  "runs": [],
  "scenarios": [],
  "sequence": 3,
  "supersedes": "ep-omfv-2020-02-r2",
  "transitions": [
    {
      "actor": {
        "actorId": "shreyash",
        "actorType": "human"
      },
      "at": "2021-09-30T00:00:00Z",
      "checksSatisfied": [
        "charter-three-fields",
        "charter-human-accepted",
        "no-blocking-structural",
        "gaps-confirmed",
        "linchpins-human"
      ],
      "checksUnsatisfied": [],
      "from": "DRAFT",
      "policyVersion": "0.1",
      "refused": false,
      "to": "MODEL_APPROVED"
    },
    {
      "actor": {
        "actorId": "shreyash",
        "actorType": "human"
      },
      "at": "2021-09-30T00:00:00Z",
      "checksSatisfied": [
        "plan-present",
        "plan-approved-by-human",
        "plan-steps-have-authority",
        "policy-method-matches"
      ],
      "checksUnsatisfied": [],
      "from": "MODEL_APPROVED",
      "policyVersion": "0.1",
      "refused": false,
      "to": "PLAN_APPROVED"
    }
  ],
  "type": "DecisionEpisode",
  "weightSets": [
    "ws-omfv"
  ]
}
